{
  "version": "1.0.0",
  "generated_at": "2026-03-11T13:36:16.459Z",
  "count": 12,
  "entries": [
    {
      "id": "byterover-review",
      "name": "ByteRover Code Review",
      "version": "1.0.0",
      "description": "Review code changes against stored conventions, patterns, architecture decisions, and security standards",
      "long_description": "A structured workflow for reviewing code changes against the project's documented conventions, patterns, and architecture decisions stored in ByteRover's knowledge base. Checks staged changes or specific files for convention violations, pattern mismatches, layer boundary issues, missing tests, and security concerns. Curates newly discovered patterns back into the knowledge base.",
      "type": "agent-skill",
      "author": {
        "name": "wzlng",
        "url": "https://github.com/wzlng",
        "username": "wzlng",
        "avatar_url": "https://avatars.githubusercontent.com/u/74853570?s=64&v=4"
      },
      "license": "MIT",
      "tags": [
        "code-review",
        "conventions",
        "byterover",
        "security",
        "architecture",
        "quality"
      ],
      "category": "code-quality",
      "path": "skills/byterover-review",
      "path_url": "https://hub.byterover.dev/byterover-review",
      "manifest_url": "https://hub.byterover.dev/v/skills/byterover-review/manifest.json",
      "readme_url": "https://hub.byterover.dev/v/skills/byterover-review/README.md",
      "file_tree": [
        {
          "name": "SKILL.md",
          "url": "https://hub.byterover.dev/r/skills/byterover-review/SKILL.md"
        }
      ],
      "created_at": "2026-02-17T00:00:00Z",
      "updated_at": "2026-03-11T13:36:16.459Z",
      "dependencies": [],
      "metadata": {
        "use_cases": [
          "Pre-commit review",
          "Pull request review",
          "Convention compliance check",
          "Security review"
        ]
      }
    },
    {
      "id": "byterover-plan",
      "name": "ByteRover Context-Aware Planning",
      "version": "1.0.0",
      "description": "Create structured implementation plans informed by existing knowledge using goal-backward analysis",
      "long_description": "A structured workflow for creating implementation plans that leverage ByteRover's existing knowledge. Queries architecture, conventions, and related implementations, then uses goal-backward methodology to derive concrete tasks from desired outcomes. Produces a sequenced task breakdown with file paths, verification steps, and dependencies. Stores the plan via brv curate for downstream execution.",
      "type": "agent-skill",
      "author": {
        "name": "wzlng",
        "url": "https://github.com/wzlng",
        "username": "wzlng",
        "avatar_url": "https://avatars.githubusercontent.com/u/74853570?s=64&v=4"
      },
      "license": "MIT",
      "tags": [
        "planning",
        "implementation",
        "byterover",
        "goal-backward",
        "task-breakdown",
        "architecture"
      ],
      "category": "productivity",
      "path": "skills/byterover-plan",
      "path_url": "https://hub.byterover.dev/byterover-plan",
      "manifest_url": "https://hub.byterover.dev/v/skills/byterover-plan/manifest.json",
      "readme_url": "https://hub.byterover.dev/v/skills/byterover-plan/README.md",
      "file_tree": [
        {
          "name": "SKILL.md",
          "url": "https://hub.byterover.dev/r/skills/byterover-plan/SKILL.md"
        }
      ],
      "created_at": "2026-02-17T00:00:00Z",
      "updated_at": "2026-03-11T13:36:16.459Z",
      "dependencies": [],
      "metadata": {
        "use_cases": [
          "Feature implementation planning",
          "Complex task decomposition",
          "Multi-file refactor planning",
          "Scope analysis and task sequencing"
        ]
      }
    },
    {
      "id": "byterover-explore",
      "name": "ByteRover Explore",
      "version": "1.0.0",
      "description": "Systematically explore a codebase and curate findings into ByteRover's context tree",
      "long_description": "A structured workflow for systematically exploring a codebase and curating findings into ByteRover's context tree. Maps technology stack, architecture, conventions, testing patterns, integrations, and concerns via brv curate. Also assesses documentation coverage and identifies knowledge gaps.",
      "type": "agent-skill",
      "author": {
        "name": "wzlng",
        "url": "https://github.com/wzlng",
        "username": "wzlng",
        "avatar_url": "https://avatars.githubusercontent.com/u/74853570?s=64&v=4"
      },
      "license": "MIT",
      "tags": [
        "exploration",
        "onboarding",
        "byterover",
        "codebase-mapping",
        "knowledge",
        "documentation"
      ],
      "category": "analysis",
      "path": "skills/byterover-explore",
      "path_url": "https://hub.byterover.dev/byterover-explore",
      "manifest_url": "https://hub.byterover.dev/v/skills/byterover-explore/manifest.json",
      "readme_url": "https://hub.byterover.dev/v/skills/byterover-explore/README.md",
      "file_tree": [
        {
          "name": "SKILL.md",
          "url": "https://hub.byterover.dev/r/skills/byterover-explore/SKILL.md"
        }
      ],
      "created_at": "2026-02-17T00:00:00Z",
      "updated_at": "2026-03-11T13:36:16.459Z",
      "dependencies": [],
      "metadata": {
        "use_cases": [
          "New codebase onboarding",
          "Building a knowledge base from scratch",
          "Post-refactor knowledge refresh",
          "Documentation coverage audit"
        ]
      }
    },
    {
      "id": "byterover-audit",
      "name": "ByteRover Knowledge Audit",
      "version": "1.0.0",
      "description": "Audit knowledge freshness and coverage, identify stale entries and gaps, and provide remediation commands",
      "long_description": "A structured workflow for auditing the health of your ByteRover knowledge base. Cross-references documented knowledge against the current codebase to find stale entries, missing coverage, and knowledge drift. Produces a coverage report with prioritized, actionable brv curate commands to fix issues.",
      "type": "agent-skill",
      "author": {
        "name": "wzlng",
        "url": "https://github.com/wzlng",
        "username": "wzlng",
        "avatar_url": "https://avatars.githubusercontent.com/u/74853570?s=64&v=4"
      },
      "license": "MIT",
      "tags": [
        "audit",
        "knowledge",
        "byterover",
        "documentation",
        "staleness",
        "coverage"
      ],
      "category": "analysis",
      "path": "skills/byterover-audit",
      "path_url": "https://hub.byterover.dev/byterover-audit",
      "manifest_url": "https://hub.byterover.dev/v/skills/byterover-audit/manifest.json",
      "readme_url": "https://hub.byterover.dev/v/skills/byterover-audit/README.md",
      "file_tree": [
        {
          "name": "SKILL.md",
          "url": "https://hub.byterover.dev/r/skills/byterover-audit/SKILL.md"
        }
      ],
      "created_at": "2026-02-17T00:00:00Z",
      "updated_at": "2026-03-11T13:36:16.459Z",
      "dependencies": [],
      "metadata": {
        "use_cases": [
          "Post-refactor knowledge validation",
          "Periodic knowledge base maintenance",
          "Knowledge drift detection",
          "Pre-feature documentation check"
        ]
      }
    },
    {
      "id": "byterover-milestone",
      "name": "ByteRover Milestone Planning",
      "version": "1.0.0",
      "description": "Define project milestones with goals, scoped requirements, phased roadmaps, and implementation decisions",
      "long_description": "A structured workflow for defining what to build next. Gathers goals through user conversation, scopes requirements with REQ-IDs for traceability, derives a phased roadmap using goal-backward analysis, and optionally captures implementation decisions for gray areas. Stores everything in the knowledge base via brv curate for downstream planning and execution.",
      "type": "agent-skill",
      "author": {
        "name": "wzlng",
        "url": "https://github.com/wzlng",
        "username": "wzlng",
        "avatar_url": "https://avatars.githubusercontent.com/u/74853570?s=64&v=4"
      },
      "license": "MIT",
      "tags": [
        "milestone",
        "planning",
        "byterover",
        "requirements",
        "roadmap",
        "scoping"
      ],
      "category": "productivity",
      "path": "skills/byterover-milestone",
      "path_url": "https://hub.byterover.dev/byterover-milestone",
      "manifest_url": "https://hub.byterover.dev/v/skills/byterover-milestone/manifest.json",
      "readme_url": "https://hub.byterover.dev/v/skills/byterover-milestone/README.md",
      "file_tree": [
        {
          "name": "SKILL.md",
          "url": "https://hub.byterover.dev/r/skills/byterover-milestone/SKILL.md"
        }
      ],
      "created_at": "2026-02-17T00:00:00Z",
      "updated_at": "2026-03-11T13:36:16.459Z",
      "dependencies": [],
      "metadata": {
        "use_cases": [
          "New project kickoff",
          "Next milestone definition",
          "Requirements scoping and prioritization",
          "Phased roadmap creation"
        ]
      }
    },
    {
      "id": "byterover-execute",
      "name": "ByteRover Phase Execution",
      "version": "1.0.0",
      "description": "Execute a phase plan task by task with verification, atomic commits, and progress tracking",
      "long_description": "A structured workflow for executing implementation plans created by byterover-plan. Works through tasks sequentially, verifies each against success criteria, creates atomic git commits, records progress in the knowledge base via brv curate, and validates the phase goal before transitioning to the next phase.",
      "type": "agent-skill",
      "author": {
        "name": "wzlng",